{
  "record_type": "tag",
  "schema_version": 1,
  "tag_slug": "fixture-tag",
  "created_at": "2026-09-02T12:00:00Z",
  "display_name": "Fixture tag",
  "status": "proposed",
  "scope": "tests",
  "description": "Valid proposed tag fixture.",
  "created_by": "review-session",
  "accepted_by": null,
  "accepted_at": null,
  "acceptance_basis": null,
  "notes": ""
}
